[
  {
    "id": "2026-05-18-0915-cca-domain-quote-acme",
    "state": "intake",
    "raised_at": "2026-05-18T09:15:00Z",
    "raised_by": "email",
    "source_ref": "gmail-thread-189f3b7ac2",
    "summary": "Acme Roofing asked for an updated domain + hosting quote",
    "tenant": "cca",
    "operator_phone": null,
    "email_authorized_by_mike": null,
    "recipient": null,
    "state_history": [
      {
        "state": "intake",
        "at": "2026-05-18T09:15:00Z",
        "by": "cca-intake-adapter@mesh"
      }
    ],
    "clerk_session_id": null,
    "lock_required": true,
    "defer_count": 0,
    "failure_modes": [],
    "dedup_hash": "sha1:cca:gmail-thread-189f3b7ac2:acme-roofing-quote",
    "recipient_role": null,
    "linked_to": [],
    "notification_policy": {
      "mode": "roll_up_daily"
    }
  },
  {
    "id": "2026-05-18-1830-cca-followup-decking",
    "state": "scheduled",
    "raised_at": "2026-05-18T18:30:00Z",
    "raised_by": "sms",
    "source_ref": "SM7c2a9f1e88b4d40a91ab0a3a2f1b8c01",
    "summary": "Operator asked for callback re Seattle decking install timing",
    "tenant": "cca",
    "operator_phone": "+14374559131",
    "email_authorized_by_mike": null,
    "recipient": null,
    "scheduled_at": "2026-05-19T14:00:00Z",
    "state_history": [
      {
        "state": "intake",
        "at": "2026-05-18T18:30:00Z",
        "by": "sms-router@mesh"
      },
      {
        "state": "shop-floor",
        "at": "2026-05-18T18:32:00Z",
        "by": "cca-tenant-agent@mesh"
      },
      {
        "state": "planned",
        "at": "2026-05-18T18:55:00Z",
        "by": "cca-tenant-agent@mesh"
      },
      {
        "state": "scheduled",
        "at": "2026-05-18T19:01:00Z",
        "by": "cca-tenant-agent@mesh"
      }
    ],
    "clerk_session_id": null,
    "lock_required": true,
    "defer_count": 1,
    "failure_modes": [
      "latency_budget_exceeded"
    ],
    "dedup_hash": "sha1:cca:SM7c2a9f1e88b4d40a91ab0a3a2f1b8c01:decking-callback",
    "recipient_role": "operator",
    "linked_to": [],
    "research_at": "2026-05-19T13:00:00Z",
    "notification_policy": {
      "mode": "inline"
    }
  },
  {
    "id": "2026-05-18-1411-kitchen-cabinets-upload",
    "state": "in-flight",
    "raised_at": "2026-05-18T14:11:53Z",
    "raised_by": "voice",
    "source_ref": "voice-session-7e2dd8a4-line-42",
    "summary": "MP4 walkthrough of kitchen-cabinets job \u2014 Danielle canvas upload",
    "tenant": "danielle",
    "operator_phone": null,
    "email_authorized_by_mike": null,
    "recipient": null,
    "state_history": [
      {
        "state": "intake",
        "at": "2026-05-18T14:11:53Z",
        "by": "danielle-voice@mesh"
      },
      {
        "state": "in-flight",
        "at": "2026-05-18T14:11:55Z",
        "by": "danielle-voice@mesh"
      }
    ],
    "clerk_session_id": "sess_2nWqLk9rTfBy",
    "lock_required": true,
    "defer_count": 0,
    "failure_modes": [],
    "dedup_hash": "sha1:danielle:voice-session-7e2dd8a4-line-42:kitchen-cabinets-mp4",
    "recipient_role": null,
    "linked_to": [],
    "notification_policy": {
      "mode": "on_finding",
      "on_finding_threshold": {
        "metric": "research_delta_score",
        "comparator": "gte",
        "value": 0.8,
        "cooldown_seconds": 3600
      }
    }
  },
  {
    "id": "2026-05-19-0930-josh-brief-task-74-plan",
    "state": "scheduled",
    "raised_at": "2026-05-19T09:30:00Z",
    "raised_by": "brief",
    "source_ref": "morning-brief-2026-05-18-mike-reply",
    "summary": "Brief task #74 \u2014 both phases populated, default delta of 60min",
    "tenant": "josh",
    "operator_phone": null,
    "email_authorized_by_mike": null,
    "recipient": null,
    "research_at": "2026-05-20T13:00:00Z",
    "scheduled_at": "2026-05-20T14:00:00Z",
    "state_history": [
      {
        "state": "intake",
        "at": "2026-05-19T09:30:00Z",
        "by": "josh-desktop@mesh"
      },
      {
        "state": "shop-floor",
        "at": "2026-05-19T09:32:00Z",
        "by": "josh-desktop@mesh"
      },
      {
        "state": "planned",
        "at": "2026-05-19T09:45:00Z",
        "by": "josh-desktop@mesh"
      },
      {
        "state": "scheduled",
        "at": "2026-05-19T09:46:00Z",
        "by": "josh-desktop@mesh"
      }
    ],
    "clerk_session_id": null,
    "lock_required": true,
    "defer_count": 0,
    "failure_modes": [],
    "dedup_hash": "sha1:josh:morning-brief-2026-05-18-mike-reply:brief-task-74",
    "recipient_role": "mike",
    "linked_to": [],
    "notification_policy": {
      "mode": "roll_up_daily"
    }
  },
  {
    "id": "2026-05-19-1015-cca-research-blocker-parked",
    "state": "parked",
    "raised_at": "2026-05-19T10:15:00Z",
    "raised_by": "email",
    "source_ref": "gmail-thread-2a9c4f1d77",
    "summary": "Roof quote follow-up \u2014 research found permission drift; awaiting Mike auth",
    "tenant": "cca",
    "operator_phone": null,
    "email_authorized_by_mike": null,
    "recipient": null,
    "research_at": "2026-05-19T13:00:00Z",
    "scheduled_at": "2026-05-19T14:00:00Z",
    "parked_until": "2026-05-20T00:00:00Z",
    "state_history": [
      {
        "state": "intake",
        "at": "2026-05-19T10:15:00Z",
        "by": "cca-intake-adapter@mesh"
      },
      {
        "state": "shop-floor",
        "at": "2026-05-19T10:16:00Z",
        "by": "cca-tenant-agent@mesh"
      },
      {
        "state": "planned",
        "at": "2026-05-19T10:40:00Z",
        "by": "cca-tenant-agent@mesh"
      },
      {
        "state": "scheduled",
        "at": "2026-05-19T10:41:00Z",
        "by": "cca-tenant-agent@mesh"
      },
      {
        "state": "parked",
        "at": "2026-05-19T13:02:00Z",
        "by": "cca-research-agent@mesh"
      }
    ],
    "clerk_session_id": null,
    "lock_required": true,
    "defer_count": 0,
    "failure_modes": [
      "permission_drift_breaks_protocol_channel"
    ],
    "dedup_hash": "sha1:cca:gmail-thread-2a9c4f1d77:roof-quote-followup",
    "recipient_role": "mike",
    "linked_to": [],
    "notification_policy": {
      "mode": "roll_up_daily"
    }
  }
]
